{
  "$schema": "../schema.json",
  "id": "t8212",
  "identity": {
    "display_name": "Video Doorbell 2C (Battery)",
    "model_codes": [
      "T8212"
    ],
    "models_raw": "T8212",
    "aliases": [
      "Video Doorbell 2C (Battery)",
      "T8212"
    ],
    "product_category": "Battery doorbell (microSD)"
  },
  "device_registry": {
    "mapping_confidence": "not_in_registry",
    "docs_status": "Not in docs",
    "property_count": 0,
    "command_count": 0,
    "coverage": "none"
  },
  "observations": {
    "night_vision_control": "unknown (no declared type)",
    "currently_sold": "Not seen in US collection pages checked (likely legacy)",
    "notes": "No dedicated type identified; may map onto BATTERY_DOORBELL (id 7) - unverified."
  },
  "capabilities": {
    "hardware_feature": [
      {
        "key": "power",
        "context": "default",
        "available": "yes",
        "label": "Battery 6,500 mAh (180 days) or wired 8-24 V",
        "access": "n/a (descriptive)",
        "value": {
          "value_type": "text"
        },
        "evidence": {
          "evidence_tier": "vendor_documented",
          "hardware_verified": "no",
          "evidence_source": "eufy.com / service.eufy.com product & comparison pages (compiled Sep 2026); descriptive only, not evidence of a writable control",
          "verified_date": "2026-09-21",
          "confidence": "medium"
        }
      },
      {
        "key": "res",
        "context": "default",
        "available": "yes",
        "label": "2K (2560x1920), WDR",
        "access": "n/a (descriptive)",
        "value": {
          "value_type": "text"
        },
        "evidence": {
          "evidence_tier": "vendor_documented",
          "hardware_verified": "no",
          "evidence_source": "eufy.com / service.eufy.com product & comparison pages (compiled Sep 2026); descriptive only, not evidence of a writable control",
          "verified_date": "2026-09-21",
          "confidence": "medium"
        }
      },
      {
        "key": "fov",
        "context": "default",
        "available": "yes",
        "label": "160°",
        "access": "n/a (descriptive)",
        "value": {
          "value_type": "text"
        },
        "evidence": {
          "evidence_tier": "vendor_documented",
          "hardware_verified": "no",
          "evidence_source": "eufy.com / service.eufy.com product & comparison pages (compiled Sep 2026); descriptive only, not evidence of a writable control",
          "verified_date": "2026-09-21",
          "confidence": "medium"
        }
      },
      {
        "key": "storage",
        "context": "default",
        "available": "yes",
        "label": "16 GB microSD card (comparison table)",
        "access": "n/a (descriptive)",
        "value": {
          "value_type": "text"
        },
        "evidence": {
          "evidence_tier": "vendor_documented",
          "hardware_verified": "no",
          "evidence_source": "eufy.com / service.eufy.com product & comparison pages (compiled Sep 2026); descriptive only, not evidence of a writable control",
          "verified_date": "2026-09-21",
          "confidence": "medium"
        }
      },
      {
        "key": "hub",
        "context": "default",
        "available": "yes",
        "label": "Wi-Fi chime/mechanical",
        "access": "n/a (descriptive)",
        "value": {
          "value_type": "text"
        },
        "evidence": {
          "evidence_tier": "vendor_documented",
          "hardware_verified": "no",
          "evidence_source": "eufy.com / service.eufy.com product & comparison pages (compiled Sep 2026); descriptive only, not evidence of a writable control",
          "verified_date": "2026-09-21",
          "confidence": "medium"
        }
      },
      {
        "key": "wifi",
        "context": "default",
        "available": "yes",
        "label": "2.4 GHz",
        "access": "n/a (descriptive)",
        "value": {
          "value_type": "text"
        },
        "evidence": {
          "evidence_tier": "vendor_documented",
          "hardware_verified": "no",
          "evidence_source": "eufy.com / service.eufy.com product & comparison pages (compiled Sep 2026); descriptive only, not evidence of a writable control",
          "verified_date": "2026-09-21",
          "confidence": "medium"
        }
      },
      {
        "key": "ai",
        "context": "default",
        "available": "yes",
        "label": "Human & face",
        "access": "n/a (descriptive)",
        "value": {
          "value_type": "text"
        },
        "evidence": {
          "evidence_tier": "vendor_documented",
          "hardware_verified": "no",
          "evidence_source": "eufy.com / service.eufy.com product & comparison pages (compiled Sep 2026); descriptive only, not evidence of a writable control",
          "verified_date": "2026-09-21",
          "confidence": "medium"
        }
      },
      {
        "key": "ip",
        "context": "default",
        "available": "yes",
        "label": "IP65",
        "access": "n/a (descriptive)",
        "value": {
          "value_type": "text"
        },
        "evidence": {
          "evidence_tier": "vendor_documented",
          "hardware_verified": "no",
          "evidence_source": "eufy.com / service.eufy.com product & comparison pages (compiled Sep 2026); descriptive only, not evidence of a writable control",
          "verified_date": "2026-09-21",
          "confidence": "medium"
        }
      }
    ],
    "external_coverage": [
      {
        "key": "none",
        "context": "default",
        "available": "no",
        "label": "No device-type or property declarations in the imported research",
        "access": "-",
        "evidence": {
          "evidence_tier": "externally_declared",
          "hardware_verified": "no",
          "evidence_source": "Imported device capability research",
          "verified_date": "2026-09-21",
          "confidence": "medium",
          "notes": "Hardware description exists (vendor_documented rows) but nothing is declared for property/command control. Do not treat as supported/controllable."
        }
      }
    ]
  }
}
