{
  "$schema": "../schema.json",
  "id": "t8p00",
  "identity": {
    "display_name": "PoE Cam E40 (bullet)",
    "model_codes": [
      "T8P00",
      "T8P00121"
    ],
    "models_raw": "T8P00 (product code T8P00121)",
    "aliases": [
      "PoE Cam E40 (bullet)",
      "T8P00",
      "T8P00121"
    ],
    "product_category": "PoE bullet camera (NVR S4)"
  },
  "device_registry": {
    "mapping_confidence": "not_in_registry",
    "docs_status": "Not in docs",
    "property_count": 0,
    "command_count": 0,
    "coverage": "none"
  },
  "observations": {
    "night_vision_control": "unknown (no declared type)",
    "currently_sold": "Yes - listed on eufy.com US",
    "notes": "No device_type in the imported property catalogue (not supported / would log \"unknown device\")"
  },
  "capabilities": {
    "hardware_feature": [
      {
        "key": "power",
        "context": "default",
        "available": "yes",
        "label": "PoE",
        "access": "n/a (descriptive)",
        "value": {
          "value_type": "text"
        },
        "evidence": {
          "evidence_tier": "vendor_documented",
          "hardware_verified": "no",
          "evidence_source": "eufy.com / service.eufy.com product & comparison pages (compiled Sep 2026); descriptive only, not evidence of a writable control",
          "verified_date": "2026-09-21",
          "confidence": "medium"
        }
      },
      {
        "key": "res",
        "context": "default",
        "available": "yes",
        "label": "4K UHD (8 MP)",
        "access": "n/a (descriptive)",
        "value": {
          "value_type": "text"
        },
        "evidence": {
          "evidence_tier": "vendor_documented",
          "hardware_verified": "no",
          "evidence_source": "eufy.com / service.eufy.com product & comparison pages (compiled Sep 2026); descriptive only, not evidence of a writable control",
          "verified_date": "2026-09-21",
          "confidence": "medium"
        }
      },
      {
        "key": "fov",
        "context": "default",
        "available": "yes",
        "label": "122°",
        "access": "n/a (descriptive)",
        "value": {
          "value_type": "text"
        },
        "evidence": {
          "evidence_tier": "vendor_documented",
          "hardware_verified": "no",
          "evidence_source": "eufy.com / service.eufy.com product & comparison pages (compiled Sep 2026); descriptive only, not evidence of a writable control",
          "verified_date": "2026-09-21",
          "confidence": "medium"
        }
      },
      {
        "key": "nv",
        "context": "default",
        "available": "yes",
        "label": "Starlight colour NV (AI-ISP); HDR",
        "access": "n/a (descriptive)",
        "value": {
          "value_type": "text"
        },
        "evidence": {
          "evidence_tier": "vendor_documented",
          "hardware_verified": "no",
          "evidence_source": "eufy.com / service.eufy.com product & comparison pages (compiled Sep 2026); descriptive only, not evidence of a writable control",
          "verified_date": "2026-09-21",
          "confidence": "medium"
        }
      },
      {
        "key": "light",
        "context": "default",
        "available": "yes",
        "label": "Red/blue strobe",
        "access": "n/a (descriptive)",
        "value": {
          "value_type": "text"
        },
        "evidence": {
          "evidence_tier": "vendor_documented",
          "hardware_verified": "no",
          "evidence_source": "eufy.com / service.eufy.com product & comparison pages (compiled Sep 2026); descriptive only, not evidence of a writable control",
          "verified_date": "2026-09-21",
          "confidence": "medium"
        }
      },
      {
        "key": "hub",
        "context": "default",
        "available": "yes",
        "label": "eufy NVR S4 required",
        "access": "n/a (descriptive)",
        "value": {
          "value_type": "text"
        },
        "evidence": {
          "evidence_tier": "vendor_documented",
          "hardware_verified": "no",
          "evidence_source": "eufy.com / service.eufy.com product & comparison pages (compiled Sep 2026); descriptive only, not evidence of a writable control",
          "verified_date": "2026-09-21",
          "confidence": "medium"
        }
      },
      {
        "key": "wifi",
        "context": "default",
        "available": "yes",
        "label": "Ethernet (PoE)",
        "access": "n/a (descriptive)",
        "value": {
          "value_type": "text"
        },
        "evidence": {
          "evidence_tier": "vendor_documented",
          "hardware_verified": "no",
          "evidence_source": "eufy.com / service.eufy.com product & comparison pages (compiled Sep 2026); descriptive only, not evidence of a writable control",
          "verified_date": "2026-09-21",
          "confidence": "medium"
        }
      },
      {
        "key": "audio",
        "context": "default",
        "available": "yes",
        "label": "Two-way (AI noise reduction)",
        "access": "n/a (descriptive)",
        "value": {
          "value_type": "text"
        },
        "evidence": {
          "evidence_tier": "vendor_documented",
          "hardware_verified": "no",
          "evidence_source": "eufy.com / service.eufy.com product & comparison pages (compiled Sep 2026); descriptive only, not evidence of a writable control",
          "verified_date": "2026-09-21",
          "confidence": "medium"
        }
      },
      {
        "key": "siren",
        "context": "default",
        "available": "yes",
        "label": "Smart siren (strobe)",
        "access": "n/a (descriptive)",
        "value": {
          "value_type": "text"
        },
        "evidence": {
          "evidence_tier": "vendor_documented",
          "hardware_verified": "no",
          "evidence_source": "eufy.com / service.eufy.com product & comparison pages (compiled Sep 2026); descriptive only, not evidence of a writable control",
          "verified_date": "2026-09-21",
          "confidence": "medium"
        }
      },
      {
        "key": "ai",
        "context": "default",
        "available": "yes",
        "label": "People, pets, vehicles",
        "access": "n/a (descriptive)",
        "value": {
          "value_type": "text"
        },
        "evidence": {
          "evidence_tier": "vendor_documented",
          "hardware_verified": "no",
          "evidence_source": "eufy.com / service.eufy.com product & comparison pages (compiled Sep 2026); descriptive only, not evidence of a writable control",
          "verified_date": "2026-09-21",
          "confidence": "medium"
        }
      },
      {
        "key": "ip",
        "context": "default",
        "available": "yes",
        "label": "IP67",
        "access": "n/a (descriptive)",
        "value": {
          "value_type": "text"
        },
        "evidence": {
          "evidence_tier": "vendor_documented",
          "hardware_verified": "no",
          "evidence_source": "eufy.com / service.eufy.com product & comparison pages (compiled Sep 2026); descriptive only, not evidence of a writable control",
          "verified_date": "2026-09-21",
          "confidence": "medium"
        }
      },
      {
        "key": "voice",
        "context": "default",
        "available": "yes",
        "label": "Alexa, Google Assistant",
        "access": "n/a (descriptive)",
        "value": {
          "value_type": "text"
        },
        "evidence": {
          "evidence_tier": "vendor_documented",
          "hardware_verified": "no",
          "evidence_source": "eufy.com / service.eufy.com product & comparison pages (compiled Sep 2026); descriptive only, not evidence of a writable control",
          "verified_date": "2026-09-21",
          "confidence": "medium"
        }
      }
    ],
    "external_coverage": [
      {
        "key": "none",
        "context": "default",
        "available": "no",
        "label": "No device-type or property declarations in the imported research",
        "access": "-",
        "evidence": {
          "evidence_tier": "externally_declared",
          "hardware_verified": "no",
          "evidence_source": "Imported device capability research",
          "verified_date": "2026-09-21",
          "confidence": "medium",
          "notes": "Hardware description exists (vendor_documented rows) but nothing is declared for property/command control. Do not treat as supported/controllable."
        }
      }
    ]
  }
}
