{
  "$schema": "../schema.json",
  "id": "t7100120",
  "identity": {
    "display_name": "PoE Bullet-PTZ Cam E50",
    "model_codes": [
      "T7100120"
    ],
    "models_raw": "T7100120 (NVR Security System E50 = E7100121)",
    "aliases": [
      "PoE Bullet-PTZ Cam E50",
      "T7100120"
    ],
    "product_category": "Wired PoE hybrid bullet + 4K PTZ dual-lens camera (NVR)"
  },
  "device_registry": {
    "mapping_confidence": "not_in_registry",
    "docs_status": "Not in docs",
    "property_count": 0,
    "command_count": 0,
    "coverage": "none"
  },
  "observations": {
    "night_vision_control": "unknown (no declared type)",
    "currently_sold": "Yes - listed on eufy.com US (Sep 2026), $249.99",
    "notes": "ADDED after research (IFA/2026 launch). Different product from PoE Bullet-PTZ Cam S4 (T8E00, type 301). No external declaration type; device_type unknown (the S4 PoE T8E00 = 301 and E41 turret T8P10 = 303 were reported in GitHub issue #898)."
  },
  "capabilities": {
    "hardware_feature": [
      {
        "key": "power",
        "context": "default",
        "available": "yes",
        "label": "PoE (single cable)",
        "access": "n/a (descriptive)",
        "value": {
          "value_type": "text"
        },
        "evidence": {
          "evidence_tier": "vendor_documented",
          "hardware_verified": "no",
          "evidence_source": "eufy.com / service.eufy.com product & comparison pages (compiled Sep 2026); descriptive only, not evidence of a writable control",
          "verified_date": "2026-09-21",
          "confidence": "medium"
        }
      },
      {
        "key": "res",
        "context": "default",
        "available": "yes",
        "label": "4K PTZ lens + 2K wide-angle lens (dual-lens)",
        "access": "n/a (descriptive)",
        "value": {
          "value_type": "text"
        },
        "evidence": {
          "evidence_tier": "vendor_documented",
          "hardware_verified": "no",
          "evidence_source": "eufy.com / service.eufy.com product & comparison pages (compiled Sep 2026); descriptive only, not evidence of a writable control",
          "verified_date": "2026-09-21",
          "confidence": "medium"
        }
      },
      {
        "key": "lens",
        "context": "default",
        "available": "yes",
        "label": "Dual lens (fixed wide + PTZ)",
        "access": "n/a (descriptive)",
        "value": {
          "value_type": "text"
        },
        "evidence": {
          "evidence_tier": "vendor_documented",
          "hardware_verified": "no",
          "evidence_source": "eufy.com / service.eufy.com product & comparison pages (compiled Sep 2026); descriptive only, not evidence of a writable control",
          "verified_date": "2026-09-21",
          "confidence": "medium"
        }
      },
      {
        "key": "ptz",
        "context": "default",
        "available": "yes",
        "label": "Yes (4K PTZ)",
        "access": "n/a (descriptive)",
        "value": {
          "value_type": "text"
        },
        "evidence": {
          "evidence_tier": "vendor_documented",
          "hardware_verified": "no",
          "evidence_source": "eufy.com / service.eufy.com product & comparison pages (compiled Sep 2026); descriptive only, not evidence of a writable control",
          "verified_date": "2026-09-21",
          "confidence": "medium"
        }
      },
      {
        "key": "track",
        "context": "default",
        "available": "yes",
        "label": "OmniTrack auto-follow; cross-cam tracking (NVR)",
        "access": "n/a (descriptive)",
        "value": {
          "value_type": "text"
        },
        "evidence": {
          "evidence_tier": "vendor_documented",
          "hardware_verified": "no",
          "evidence_source": "eufy.com / service.eufy.com product & comparison pages (compiled Sep 2026); descriptive only, not evidence of a writable control",
          "verified_date": "2026-09-21",
          "confidence": "medium"
        }
      },
      {
        "key": "light",
        "context": "default",
        "available": "yes",
        "label": "Strobe deterrence",
        "access": "n/a (descriptive)",
        "value": {
          "value_type": "text"
        },
        "evidence": {
          "evidence_tier": "vendor_documented",
          "hardware_verified": "no",
          "evidence_source": "eufy.com / service.eufy.com product & comparison pages (compiled Sep 2026); descriptive only, not evidence of a writable control",
          "verified_date": "2026-09-21",
          "confidence": "medium"
        }
      },
      {
        "key": "ai",
        "context": "default",
        "available": "yes",
        "label": "OmniTrack AI",
        "access": "n/a (descriptive)",
        "value": {
          "value_type": "text"
        },
        "evidence": {
          "evidence_tier": "vendor_documented",
          "hardware_verified": "no",
          "evidence_source": "eufy.com / service.eufy.com product & comparison pages (compiled Sep 2026); descriptive only, not evidence of a writable control",
          "verified_date": "2026-09-21",
          "confidence": "medium"
        }
      },
      {
        "key": "ip",
        "context": "default",
        "available": "yes",
        "label": "IP65",
        "access": "n/a (descriptive)",
        "value": {
          "value_type": "text"
        },
        "evidence": {
          "evidence_tier": "vendor_documented",
          "hardware_verified": "no",
          "evidence_source": "eufy.com / service.eufy.com product & comparison pages (compiled Sep 2026); descriptive only, not evidence of a writable control",
          "verified_date": "2026-09-21",
          "confidence": "medium"
        }
      },
      {
        "key": "hub",
        "context": "default",
        "available": "yes",
        "label": "eufy NVR systems (occupies two livestream channels)",
        "access": "n/a (descriptive)",
        "value": {
          "value_type": "text"
        },
        "evidence": {
          "evidence_tier": "vendor_documented",
          "hardware_verified": "no",
          "evidence_source": "eufy.com / service.eufy.com product & comparison pages (compiled Sep 2026); descriptive only, not evidence of a writable control",
          "verified_date": "2026-09-21",
          "confidence": "medium"
        }
      },
      {
        "key": "extra",
        "context": "default",
        "available": "yes",
        "label": "Price $249.99 (eufy US page)",
        "access": "n/a (descriptive)",
        "value": {
          "value_type": "text"
        },
        "evidence": {
          "evidence_tier": "vendor_documented",
          "hardware_verified": "no",
          "evidence_source": "eufy.com / service.eufy.com product & comparison pages (compiled Sep 2026); descriptive only, not evidence of a writable control",
          "verified_date": "2026-09-21",
          "confidence": "medium"
        }
      }
    ],
    "external_coverage": [
      {
        "key": "none",
        "context": "default",
        "available": "no",
        "label": "No device-type or property declarations in the imported research",
        "access": "-",
        "evidence": {
          "evidence_tier": "externally_declared",
          "hardware_verified": "no",
          "evidence_source": "Imported device capability research",
          "verified_date": "2026-09-21",
          "confidence": "medium",
          "notes": "Hardware description exists (vendor_documented rows) but nothing is declared for property/command control. Do not treat as supported/controllable."
        }
      }
    ]
  }
}
