{
  "$schema": "../schema.json",
  "id": "video-doorbell-s4",
  "identity": {
    "display_name": "Video Doorbell S4",
    "model_codes": [],
    "models_raw": "Video Doorbell S4 (UK bundle product code E82153F1; T-code not confirmed)",
    "aliases": [
      "Video Doorbell S4"
    ],
    "product_category": "Video doorbell (wired; power options disputed)"
  },
  "device_registry": {
    "mapping_confidence": "not_in_registry",
    "docs_status": "Not in docs",
    "property_count": 0,
    "command_count": 0,
    "coverage": "none"
  },
  "observations": {
    "night_vision_control": "unknown (no declared type)",
    "currently_sold": "Yes - shipping Sep 2026 ($299-$300)",
    "notes": "ADDED after research. Announced CES 2026, shipping late Sep 2026. CONFLICT on power: eufy UK bundle page says \"Wired Video Doorbell S4\"; IFA coverage says wired, while Gizmodo says solar/battery/wired options. No external declaration type."
  },
  "capabilities": {
    "hardware_feature": [
      {
        "key": "power",
        "context": "default",
        "available": "yes",
        "label": "Wired (eufy UK page); Gizmodo also lists solar/battery options - unresolved",
        "access": "n/a (descriptive)",
        "value": {
          "value_type": "text"
        },
        "evidence": {
          "evidence_tier": "vendor_documented",
          "hardware_verified": "no",
          "evidence_source": "eufy.com / service.eufy.com product & comparison pages (compiled Sep 2026); descriptive only, not evidence of a writable control",
          "verified_date": "2026-09-21",
          "confidence": "medium"
        }
      },
      {
        "key": "res",
        "context": "default",
        "available": "yes",
        "label": "3K (Engadget: 9 MP)",
        "access": "n/a (descriptive)",
        "value": {
          "value_type": "text"
        },
        "evidence": {
          "evidence_tier": "vendor_documented",
          "hardware_verified": "no",
          "evidence_source": "eufy.com / service.eufy.com product & comparison pages (compiled Sep 2026); descriptive only, not evidence of a writable control",
          "verified_date": "2026-09-21",
          "confidence": "medium"
        }
      },
      {
        "key": "fov",
        "context": "default",
        "available": "yes",
        "label": "180° panoramic",
        "access": "n/a (descriptive)",
        "value": {
          "value_type": "text"
        },
        "evidence": {
          "evidence_tier": "vendor_documented",
          "hardware_verified": "no",
          "evidence_source": "eufy.com / service.eufy.com product & comparison pages (compiled Sep 2026); descriptive only, not evidence of a writable control",
          "verified_date": "2026-09-21",
          "confidence": "medium"
        }
      },
      {
        "key": "nv",
        "context": "default",
        "available": "yes",
        "label": "Colour night vision",
        "access": "n/a (descriptive)",
        "value": {
          "value_type": "text"
        },
        "evidence": {
          "evidence_tier": "vendor_documented",
          "hardware_verified": "no",
          "evidence_source": "eufy.com / service.eufy.com product & comparison pages (compiled Sep 2026); descriptive only, not evidence of a writable control",
          "verified_date": "2026-09-21",
          "confidence": "medium"
        }
      },
      {
        "key": "storage",
        "context": "default",
        "available": "yes",
        "label": "64 GB built-in (non-expandable, per Gizmodo)",
        "access": "n/a (descriptive)",
        "value": {
          "value_type": "text"
        },
        "evidence": {
          "evidence_tier": "vendor_documented",
          "hardware_verified": "no",
          "evidence_source": "eufy.com / service.eufy.com product & comparison pages (compiled Sep 2026); descriptive only, not evidence of a writable control",
          "verified_date": "2026-09-21",
          "confidence": "medium"
        }
      },
      {
        "key": "wifi",
        "context": "default",
        "available": "yes",
        "label": "2.4 / 5 GHz",
        "access": "n/a (descriptive)",
        "value": {
          "value_type": "text"
        },
        "evidence": {
          "evidence_tier": "vendor_documented",
          "hardware_verified": "no",
          "evidence_source": "eufy.com / service.eufy.com product & comparison pages (compiled Sep 2026); descriptive only, not evidence of a writable control",
          "verified_date": "2026-09-21",
          "confidence": "medium"
        }
      },
      {
        "key": "ai",
        "context": "default",
        "available": "yes",
        "label": "OmniTrack AI tracking; human, face, package detection; radar (per video title)",
        "access": "n/a (descriptive)",
        "value": {
          "value_type": "text"
        },
        "evidence": {
          "evidence_tier": "vendor_documented",
          "hardware_verified": "no",
          "evidence_source": "eufy.com / service.eufy.com product & comparison pages (compiled Sep 2026); descriptive only, not evidence of a writable control",
          "verified_date": "2026-09-21",
          "confidence": "medium"
        }
      },
      {
        "key": "voice",
        "context": "default",
        "available": "yes",
        "label": "Alexa, Google Home, Apple Home / HomeKit Secure Video (with HomeBase 3)",
        "access": "n/a (descriptive)",
        "value": {
          "value_type": "text"
        },
        "evidence": {
          "evidence_tier": "vendor_documented",
          "hardware_verified": "no",
          "evidence_source": "eufy.com / service.eufy.com product & comparison pages (compiled Sep 2026); descriptive only, not evidence of a writable control",
          "verified_date": "2026-09-21",
          "confidence": "medium"
        }
      },
      {
        "key": "chime",
        "context": "default",
        "available": "yes",
        "label": "Chime included",
        "access": "n/a (descriptive)",
        "value": {
          "value_type": "text"
        },
        "evidence": {
          "evidence_tier": "vendor_documented",
          "hardware_verified": "no",
          "evidence_source": "eufy.com / service.eufy.com product & comparison pages (compiled Sep 2026); descriptive only, not evidence of a writable control",
          "verified_date": "2026-09-21",
          "confidence": "medium"
        }
      },
      {
        "key": "extra",
        "context": "default",
        "available": "yes",
        "label": "24/7 recording; \"VR Mode\" for fisheye view",
        "access": "n/a (descriptive)",
        "value": {
          "value_type": "text"
        },
        "evidence": {
          "evidence_tier": "vendor_documented",
          "hardware_verified": "no",
          "evidence_source": "eufy.com / service.eufy.com product & comparison pages (compiled Sep 2026); descriptive only, not evidence of a writable control",
          "verified_date": "2026-09-21",
          "confidence": "medium"
        }
      }
    ],
    "external_coverage": [
      {
        "key": "none",
        "context": "default",
        "available": "no",
        "label": "No device-type or property declarations in the imported research",
        "access": "-",
        "evidence": {
          "evidence_tier": "externally_declared",
          "hardware_verified": "no",
          "evidence_source": "Imported device capability research",
          "verified_date": "2026-09-21",
          "confidence": "medium",
          "notes": "Hardware description exists (vendor_documented rows) but nothing is declared for property/command control. Do not treat as supported/controllable."
        }
      }
    ]
  }
}
